removed ,liberal
Just to play devil s advocate but isnt that what logical opponents to gender neutral public bathrooms argue will happen It would let pervs enter the bathroom of their choice posing as a trans person and making it harder for anyone to preemptively do anything to stop them It isn t about not letting trans people choose a bathroom it about stopping pervs from taking advantage of no one being able to complain when they follow a kid into a bathroom ,liberal
Well the only way you can be as hateful a bitch as a gop politician is by hating the fact you hate who you are ,liberal
Coming from someone from an urban educated part of North Carolina this little fun fact is fucking golden thank you ,liberal
Welcome to a news story from over a year ago ,liberal
Them GOPer s are looking more like Catholic priests all the time ,liberal
I have had a few conversations with Conservative people about the bathroom issue I always compare it to speeding in a red car being illegal It is illegal to speed Passing a unique law to make speeding in a specific color of car is pointless It is illegal to harass someone in a public bathroom regardless of the size shape or orientation of your genitalia ,liberal
Duh ,liberal
Its called self projection ,liberal
I would love politifact to check this claim out I would taunt my in laws with it ,liberal
I bet that motherfucker can t even name all 50 states without help ,liberal
I mean if we re gonna be in a war I want to win it I just don t want to us to be in a war in the first place ,liberal
I m all for winning a war if it means we STOP when we win 250 years of damn near perpetual war mongering is total bullshit ,liberal
How is this subreddit any different from all the rest of the spam I have to filter each new day ,liberal
I feel like Trump s pledge to __________ is ignorant and delusional and highly dangerous can be applied to pretty much everything ,liberal
Lol salon ,liberal
I don t understand is he saying he wants to start new wars or just win the ones we are already embroiled in Do you have a primary source for the quote ,liberal
delusional profound ignorance no understanding That s Trump to a T He s a perfect representative of the Tea Party buffoons who are his base ,liberal
1 we ve been in a war for 15 years in the Middle East 2 Wartime nostalgia isn t the same as lack of knowledge of history I think wartime nostalgia is worse than ignorance because it romanticizes victory and the suffering of innocent people for the sake of economic gain The root of the problem with the whole GOP is their fixation on winning and being right They view life as a zero sum game where in order to win others have to lose In order for you to be right see religion trustworthiness of news someone else has to be wrong There is no room for relativism or compromise meaning when it comes down to it the party leaders will either realize the mistakes they have made or turn on each other to assume the last vestiges of power they can before progressivism wins out When I deal with people in my life who subscribe to this kind of winner loser mentality I like to engage them from a personal standpoint because their moral logical basis is completely broken You need to get them to buy into the,liberal
People read Salon ,liberal
thinks ,liberal
Problem is they all think it s the rest of them and not themselves ,liberal
Drumpf is a charlatan an ignorant incompetent oafish delusional arrogant blustering inarticulate uncouth unscrupulous hypocritical malevolent autocratic thin skinned divisive grossly narcissistic sociopath a draft dodging much sued sexually assaulting numerously bankrupted pathological fabulator and liar and a political neophyte with an adolescent brain displaying chronic status twitterus a debilitating condition in which twittering fits follow one another without recovery of consciousness between them in sum a classic Dunning Kruger Peter Principle affectee utterly unfit to be POTUS Drumpf s sole reason for being is to feed his insatiable narcissism and bank account Anyone that thinks that Drumpf has ever had any sense of service other than self service or that a man who has spent his entire adult life promoting his vulgar brand and the many scams to which he has licensed his name to the cost of usually the poorly educated now cares one iota about anyone else or that he or his familia,liberal
Shared this story with my Trump supporting friends in groupme dont hate me I live in Texas today and they dont care Even when the quotes are right in front of their faces they dont give a damn This troubles me ,liberal
And in other news water is WET ,liberal
reportedly made ,liberal
Like i believe one thing that comes out of that Globalist Kushner s mouth ,liberal
First opinion from Trump I actually some what agree with ,liberal
How many ads are on that one page I don t even care anymore what he said ,liberal
Independent co uk Annnnd moving on ,liberal
That s not sketchy at all Wink ,liberal
Are you kidding me ,liberal
Trump was asking if Putin could send some Russian hookers to the White House so he could pee on them ,liberal
And they say trump isn t a Russian puppet July 8 2016 Trump associate Carter Page https www bloomberg com politics articles 2016 03 30 trump russia adviser carter page interview visits Moscow and receives an offer of equity from Russia in a massive Russian oil deal if Trump will lift US EU sanctions http www businessinsider com carter page trump russia igor sechin dossier 2017 1 These sanctions have crippled the Russian economy and hamstrung their oligarchy http www forbes com sites timdaiss 2016 08 19 prolonged sanctions rip into russia causing angst for putin 2497241c4c2f July 18 2016 Trump s team makes one tweak to the RNC platform a pro Russia softening of our stance on their invasion of Ukraine Crimea https www washingtonpost com opinions global opinions trump campaign guts gops anti russia stance on ukraine 2016 07 18 98adb3b0 4cf3 11e6 a7d8 13d06b37f256_story html utm_term bb24cd53f46b July 22 2016 Wikileaks dumps the DNC emails on the eve of the Democratic National Convention h,liberal
Can you imagine the shit fit the_donald would ve thrown if Hillary was in the White House and she turned off the recording capabilities on any foreign phone call ,liberal
Sketchy source with a fake headline This is bound to get to the front page of reddit ,liberal
https www youtube com watch v JaBlw1gNWdg ,liberal
Fucking hell Steve get a tailor ,liberal
How common is it for calls to not be recorded ,liberal
Oh another unnamed source Cause that last one about Turnbull was so right ,liberal
The vice presidency as lipstick on a pig As Indiana governor Pence was a cognitively dissonant idiot and he s a cognitively dissonant idiot now Did he think that nobody would notice the price of this little stunt and point it out Well evangelicals are a lost fucking cause but the thing is to galvanize apathetic voters to get off their asses and cast their ballot every November The trick now is to reach these people to let them know that THERE ARE ELECTIONS EVERY NOVEMBER Multi million dollar political stunt with money that could be used to feed poor children and or aid Puerto Rico Tell me again all about christian values and faith and prayer the Gospels and evangelicals Isn t it right there in Matthew 4 20 The end justifies the means Repulsive parasites on the body politic ,liberal
Suddenly he cares about tax dollars Made me giggle ,liberal
Can I get a refund on that please ,liberal
The article doesn t state when the trip was planned For it to be considered nothing more than a political stunt wouldn t the trip had to have been planned after all this kneeling stuff became big news It s not that I think this wasn t a political stunt It was but if Pence had planned this event for weeks prior it s hard to just say the entire cost is attributed to a political stunt because it would have been spent anyway Whether Pence sat in his seat for 1 hour or 5 hours seems rather irrelevant at that point doesn t it ,liberal
Haha ,liberal
Yawn Chris Murphy will go down in history as a nobody ,liberal
why do you liberals have to make democrats look like retards ,liberal
the nfl get special tax incentives based on what it claims it is the tax payers psy this ergo every nfl player kneeling us putting on a political stunt paid for by taxpayers see anyone can be trite ,liberal
a walkout is something high schoolers do to miss a day of school and it always accomplishes so much this administration is full of incompetent insecure manlets ,liberal
Not sure why he s going on about the paid for by taxpayers bit when what that really does is buy into the makers takers frame which is phony and completely misunderstands how the federal government finances its operations https www nytimes com 2017 10 05 opinion deficit tax cuts trump html ,liberal
We should also put up some Vietcong monuments while we re at it Apparently some people are very eager to support traitors to America ,liberal
Dave Chappelle relevant joke https m youtube com watch v _4WoAnty748 ,liberal
Once again the South has Spoken and they want to keep their racist monuments to protest the slaves they had to give up and the war they lost ,liberal
A member of a school board here got a visit from the secret service and was forced to resign for saying Trump should take in a show at Ford s theater It s a bit of a double standard if this guy doesn t have to answer for this ,liberal
Psh the north won the election war The south need to stop being snowflakes and get over it Talk about consultation prizes No wonder this generation is so entitled ,liberal
Maybe someone should inform him those people were Democrats ,liberal
Why are red state reps always so fucking stupid ,liberal
It is heritage not hate However someone needs to teach these people that the heritage was about hate I am thinking more and more that our governments need to stay out of the statue game Our governments are supposed to represent all people and no statue does that ,liberal
Christ I m against the removal of Lee too but that s going way too far Calm the fuck down man It s just a statue Nothing worth getting too upset over ,liberal
Jesus fucking Christ And he went out of his way to say this to anyone and everyone not even something he said he private that was leaked Racists are emboldened right now What I don t get is why southerners want memorials of a bunch of Democrat traitors Because the same people also deny that the parties are no longer the same as they were in 1865 and insists Dems are the party of slavery and racism But then they ll put up monuments of these racist libtards Something doesn t quite make sense here ,liberal
No He has goals and a philosophy If liberals choose to get offended by what he says then that s another thing ,liberal
As a Trump supporter I might actually agree with this ,liberal
Seems to be republican MO My dad lives Trump and he admits that he still supports trump because he pisses off liberals ,liberal
Hell he s great at that one thing ,liberal
I ve been saying this he s all about himself but in a very particular way He became a certain version of himself a persona for The Apprentice Then he became a different persona for his presidential bid and now as president People keep trying to find his guiding philosophy or principles but that s a wild goose chase those things are moving targets therefore they don t really exist Trump as president is pure persona nothing else He does the pandering and favor paying to keep his position i e deals with Republican leadership etc but edit dammit premature submit It is a big deal It doesn t happen to other guys in those interactions everything we normally think of as being stable or at least fake to the public stable is a potential bargaining chip or surprise move held in reserve or strategy piece His principles his platform his philosophy etc don t exist they re just assorted cards in his deck that he might or might not play or change out as necessary Trump as president is all about the pe,liberal
I guess one could say that but he seems to have authoritarian tendencies ,liberal
This is a bad place to be for the GOP as well If they have reached the point where they are no longer willing to compromise and only do things for shock value they are admitting defeat If they believe in their words they should at least try and sell those ideas to the American people and understand compromise Otherwise you are telling your voters that their political beliefs don t matter and they should instead troll the other side Because that will make for a strong country somehow ,liberal
Maybe it s because liberals get pissed off about everything outside their echo chamber and throw hissy fits and riots when someone who says something outside of their ideology tries to speak I dunno maybe grow some tougher skin and you ll be fine ,liberal
I actually believe that he has no political philosophy other than reversing Obama s accomplishments as President because Obama made fun of him a a White House Correspondent s dinner ,liberal
Both are petty ,liberal
Cause polls and statistics have always been right ,liberal
68 if respondents were cucks so their opinions didn t matter ,liberal
mandate ,liberal
They must have polled these guys https www youtube com watch v Kb6SMHULl 4 ,liberal
Well in 2008 the Presidential candidate won the popular vote ,liberal
Ya SHOULD HAVE BEEN BERNIE ,liberal
Considering 17 of the population voted for Trump that s not too bad ,liberal
I mean considering 25 of the population voted for Trump that s not terribly surprising ,liberal
So what let s be honest what remorse for what we voted going to actually do Also should we even trust polls these days ,liberal
Well I m certainly not proud of the results but I wouldn t have been proud if Clinton won either Overall I m mortified that it came down to a choice between these two candidates ,liberal
Hitler had Goering in the Reichstag Trump has McConnell Only real difference is Goering fought in WW I McConnell was up to something pretty fucking offbeat in regards to military service http www dailykos com story 2013 2 24 1189537 The Strange and Possibly Sordid Story of Mitch McConnell s Military Service ,liberal
I despise McConnell more than I despise Paul Ryan McConnell and his type are an embarrassment to our country It s almost surreal to see the Republican agenda play out and frightening to see the utter distain they have for the American people Resist Get involved engage and let your voice be heard ,liberal
His chin looks like something that needs to be drained in the ER ,liberal
That thumbnail good lord ,liberal
Every one of these fuckers that coddles Trump is going down with him as vile worthless human beings in the history books ,liberal
This fuck has the incalculably brazen gall to call democrats hypocrites for wanting an independent investigator for the Russian case Comey got canned for Says the shitheel barbarian that pushed to block Garland and whined about democrats filibustering Gorsuch I hate my states voting public so much ,liberal
deleted ,liberal
Yeah considering senate Republicans are supposed to be the less awful ones he is not a good sign for the state of that party ,liberal
He is quite a scumbag ,liberal
I m sorry but by this point anyone who does what he did today is obviously complicit He needs to be investigated ,liberal
Here is what is claimed that memo says I hope you can let this go the president told Mr Comey according to the memo And no one has yet seen that memo but it already being used to attack Comey and liberals and Democratic elected By misquoting like in the title of the article ,liberal
And if Hillary was President dropped code word information to Iran fired the FBI director because he wouldn t squash the investigation into the Clinton Foundation and asked him to arrest Fox News reporters who kept hounding on about Benghazi holy shit the Republicans would be rushing through articles of impeachment after getting their clips of asking hard hitting questions in hearings Hell Democrats would already be impeaching Clinton if that were the case we d gladly take Kaine or Pelosi over a shit travesty of a White House like this one Of course Clinton was never this corrupt regardless of what the right has been saying for decades and even if she was she certainly wouldn t be this stupid and brazen ,liberal
But the emails Benghaaazi Emails ,liberal
Don t forget Soros and Vince Also cattle futures ,liberal
And recently that one DNC staffer that was murdered in DC has started coming back up ,liberal
The timing on that was very very lucky ,liberal
So obviously there are republicans in their state congress that are doing this Democrats don t have enough votes to do it alone so are they getting the word out to their constituents as to why they are going back to the old way I don t live in KS anymore so I don t know how this is playing to the locals ,liberal
Proponents of trickle down bs will continue to sprout elsewhere including in the WH The argument will be But it s like treacle It WILL trickle down but takes time ,liberal
It s about effing time They ve got a real mess to clean up The Kansas experiment should be its own chapter in every economics textbook published from this day forward ,liberal
It s all part of the big plan Cut tax revenue by decreasing taxes for middle class slightly while cutting taxes for rich significantly Plan fails raise taxes significantly on middle class while keeping most of the tax cuts for rich ,liberal
Supply side economics is a joke and they let this clown bankrupt his state to prove it AGAIN If you gear all your policy towards tax cuts for the wealthy and deregulation you will make the rich richer at the expense of everyone else including the overall economy Republican voters have been eating this garbage since the 80s and still dont seem to get that this fucks them over more than anyone Its the economic policy version of thank you sir may I have another ,liberal
Look at one of the comments in the article Oh my CBO Fake Studies It must be nice to be a Republican so that you can say something one and immediately all of the zombies and robot in the party immediately assimilate it into their arguments ,liberal
To be fair though supply side economics has become a catch all for any tax cuts but the original economic theory that coined the term was a more specific set of policies that included cuts to government spending I don t think many reasonable economists would advocate cutting taxes in order to maintain current spending levels ,liberal
Republican who has to agree not sure why poor republicans vote for this stuff ,liberal
Yes and the poor ignorant will vote the same ones in again and again and again becuase mah guns school prayer female reproduction is up to us not them etc etc etc ,liberal
Its a truly disappointing trend in the modern national discourse ,liberal
Sessions lying under oath What else is new ,liberal
Member when James Clapper lied under oath ,liberal
He must be impeached Lying under oath to congress is a serious offense ,liberal
Keep in mind that this is all based on Session s own words FRANKEN These documents also allegedly say there was a continuing exchange of information during the campaign between Trump surrogates and intermediaries for the Russian government Again I m telling you this as it s coming out so you know But if it s true it s obviously extremely serious and if there is any evidence that anyone affiliated with the Trump campaign communicated with the Russian government in the course of this campaign what will you do SESSIONS Senator Franken I m not aware of any of those activities I have been called a surrogate at a time or two in that campaign and I did not have communications with the Russians and I m unable to comment on it Franken didn t ask if anyone affiliated with the campaign communicated with the Russians about campaign business which is what the Republican establishment is now trying to defend against He asked is anyone affiliated with the campaign communicated with the Russians durin,liberal
Let s keep in mind that President Clinton was flayed for perjury over a topic that many considered rather innocuous If Sessions is guilty of perjury he has to go We should hold the chief enforcer of our laws to no less of a standard ,liberal
So is anyone asking the big question All these Republicans were in contact with the Russian govenrment what was the deal they made We have to get to the heart of this we only know half the story Knowing the other half may save our country ,liberal
This is what needs to be reiterated time and time again There is video evidence https m youtube com watch v 2BpgHcanjCQ of him lying ,liberal
He s now claiming he s never talked to the Russian ambassador and that these allegations are all lies Classic ,liberal
Clinton was impeached for this exact scenario Lying under oath https en m wikipedia org wiki Impeachment_of_Bill_Clinton ,liberal
Remember this is a guy who thinks teens should go to jail for pot ,liberal
Same reason the left calls antifa peace protesters Everyone has a narrative ,liberal
Say it with me RADICAL RIGHT WING TERRORISM ,liberal
Because media outlets including a lot of liberals and democrats for some goddamned reason think that these cons need to be coddled and handled with baby gloves People have been pulling punches with cons for too long ,liberal
BWHAHAHAHA Antifa started the violence Call them the terrorists for attacking random people at a rally ,liberal
I am just catching up on this news but did they instigate violence at the event The pictures I saw had the police protecting them which they wouldn t be doing if the demonstration was violent Not trying to defend them but I don t think we should throw that word around lightly ,liberal
Hurricane Katrina white survivors found supplies black survivors looted ,liberal
Militia member rarely do violent things and their existence is accepted and was even promoted by the founders Their entire reason for existing is different from terrorists Militia members CAN be terrorists and I don t doubt some are but just because they re militia members doesn t make them terrorists ,liberal
These people are protecting your constitutional whites rather you like it or not But seriously I m concerned that they re all together too well regulated Here s hoping that they are in practice the idiots collectively that they obviously are individually ,liberal
Nearly everything I ve seen today has called them terrorists white supremacists and neo Nazis Doesn t seem like any media even fox news has been forgiving of them ,liberal
My honest guess is just that our media is really really hesitant to label any domestic group as terrorists Whether it s neo nazis antifa blm or the KKK we ve got plenty of groups that fit the definition and none of them as far as I know are labeled domestic terrorist groups ,liberal
Nice to hear he s driving local businesses broke while he touts his Bring Jobs Back to America campaign But good on the Dems for keeping up the pressure on Trump on all fronts Remember this is the same guy who used to pitch a bitch every time Obama picked up a golf club and it damn sure wasn t 1 7M a shot ,liberal
I hope FL Dems will take a page from Trump s playbook and hand Trump a bill during their next meeting ,liberal
Just look into Trump s feelings about OPM other people s money He is going to spend spend spend until he is not in office anymore because he doesn t have to pay for all of his new privileges and luxuries taxes fund it all now ,liberal
Have we ever had a sitting president met with so many protests at his mere presence Honest question not too familiar with the topic ,liberal
That turned out to be a made up story ,liberal
He s literally paying himself with taxpayer money ,liberal
Nixon ,liberal
Maybe LBJ ,liberal
Nope We ve never had an overt RACIST CRIMINAL INCOMPETENT president who obviously stole our election We had Bush steal an election but he wasn t a traitor like Trump ,liberal
But this early on ,liberal
One down ,liberal
So long ya Ruskie stooge ,liberal
We still need the transcripts of his phone call to Russia Since I sincerely doubt he did it on his own Trump Pence or Bannon told him to make the call And that means they ordered him to do something illegal ,liberal
So an admission of guilt What did Donnie know and when did he know it ,liberal
Huh Trump s still POTUS ,liberal
Apparently Flynn is saying he s a scapegoat on Twitter I m excited to see where this goes ,liberal
Given how long Trump took to fire campaign staff or even Flynn s son there is definitely a connection Unlike Reagan s more alleged links to the Iran Contra Scandal there s much less of an organizational buffer and much more scrutiny so more may come to light even with Flynn s sacking ,liberal
I think it has to be Trump and bannon I am starting to feel like pence knows nothing ,liberal
I m pretty sure Mr Flynn will be talking with some nice people from the government very soon Nice people who could offer him a very nice deal that keeps him out of prison ,liberal
It s a fake account http www mediaite com print new york times falls for fake michael flynn twitter account ,liberal
Look you guys if the poors cared about things they d just spend the 200 000 for a Mar a Lago membership so they could come advocate for themselves But they haven t so clearly they re happy being trampled on ,liberal
and the arts he s cutting the arts not that I am surprised he s so non classy GOP too most of them ,liberal
