removed ,liberal
I seriously hope this passes CALL YOUR REPS AND HOUND THEM ON THIS http www whoismyrepresentative com Also if you have time please try to phonebank https www grassrootspb com a bit Lines are open for 9 hours at time of posting Arturo http arturoforcongress com was Bernie s Deputy Political Director and is running for Congress in California s 34th district with an election on April 7th check out their AMA https www reddit com r SandersForPresident comments 5ufu7a arturo_carmona_here_ama and our post about them and how you can help https www reddit com r SandersForPresident comments 5wxzx8 today_is_the_turning_point_we_start_calling_to Lastly check out our round table post https www reddit com r SandersForPresident comments 5x2f4n sandersforpresident_roundtable_discussions Have a great day Pick up that phone and make some calls Edit 1 Words Edit 2 Great work with the phonebanking everyone Let s try to get another post to the front page tomorrows and maybe some phone banking Maybe in the ,liberal
Okay fine maybe Gabbard s not the exact opposite of a progressive in every conceivable way She s still overrated though ,liberal
our future female president ,liberal
My representative is the turtle so me calling him means literally nothing ,liberal
I will be shaking my proverbial pom poms over here across the pond in hope this bill passes Good luck fellow progressives ,liberal
I have hope I am a cancer patient in an illegal state where if I was caught with the amount I buy to keep from being debilitatingly sick I would be charged with a felony That s absurd I want to smoke my mj and not be anxious about it Not have to hide it I just want to be able to take my medicine without fear of being sent to jail I m not hurting anyone Just leave me in peace ,liberal
So what makes this bill different from all the other times something similar has been introduced Why are y all so hopeful this time around ,liberal
If Ttump and his Klan are smart they would get this through and take all the credit Make everyone stoned and happy all the while you are slowly raping them I am very 420 friendly and now I think am paranoid ,liberal
Do they not understand how much legalization would hurt cartels and gangs They want to take down all the bad hombres so much this would hit them harder than any dumbass wall ever will ,liberal
Wow 9K subscribes on r tulsi Awesome ,liberal
Wanna tell your senator how you feel about this Check this link https go ourrevolution com page content senate 30 hours source reddit ,liberal
As a republican I wish there was more opposition to Trump s attitudes and to DeVos I can actually agree on Sanders with this ,liberal
I wish dozens more would stand up against her I don t see any upside to her being confirmed at this point Getting an outsider can be good but she isn t the one I don t think she has any business being involved in education ,liberal
Why isn t this on all ,liberal
Isn t there two Or did they change their minds too ,liberal
I really want to hate on Hillary and the democrats real quick they didn t push Russ Feingold in Wisconsin Foster Cambell after losing the election and they back stabbed Alan Grayson because he s progressive We re now in this mess because of them ,liberal
This is all Debbie s Fault ,liberal
Nope ,liberal
No ,liberal
Rand Paul I know voted no ,liberal
Bernie continues to gather support from all walks of life Why It s something his opponents fail to understand Bernie is the real deal Celebrate Bernie s momentum and audacious stand today with Verizon workers by making ten calls http berniesanders com Phonebank or donating ten bucks https secure actblue com contribute page reddit for bernie New York won t come easy and we need everyone s help to win ,liberal
blackhandshakesmatter ,liberal
So dank ,liberal
Every presidential candidate should have to go through this https www youtube com watch v g_IJCpZfrPA ,liberal
Holy shit A handshake He must know how to lead and represent people from all walks of life ,liberal
removed ,liberal
I m not from America but this guy does seem like the real deal I have no faith he will be president though and that is a sad thought The system is banjaxed to the point where he doesn t have a chance It really sucks ,liberal
That was fucking smooth ,liberal
Yes let s make him president he knows how to shake someone s hand I guess that fact that he didn t have a real job until he was 40 also qualifies him too or maybe it s his weird ass fucking book he wrote ,liberal
That s such a presidential quality s ,liberal
Yeah because that is accurate ,liberal
You have that correct ,liberal
I m a lazy millennial you should give me free insurance and a paycheck for playing video games and living with mommy And you should pay all my student loans since my mommy can t afford to after supporting my deadbeat carcass LMAO ,liberal
Feminists be like ,liberal
Typical welfare cheat mentality Sorry but your mommy lied to you The government is not your mommy so you actually have to WORK if you want insurance ,liberal
They have go fund me pages for victims of the shooting spree ,liberal
r im14andthisisdeep ,liberal
Well one is a right and the other you re talking about government provided At the moment I have the right to healthcare if I can pay for it the same as a gun To make them the same health care and a free pistol would be provided to everyone I don t agree with this but saying they re the same isn t really fair to either side ,liberal
If certain lawmakers won t control guns for the sake of the 10 000 12 000 Americans injured or killed by guns every year why should we expect them to pay any attention to a mere 500 ,liberal
I find that I agree that he had a right to bear those arms but believe that healthcare should be a right However you d be hard pressed to find a Republican claim that he had the right use those to unleash hell on so many lives ,liberal
I donated 10 and now I m broke ,liberal
Bernie you have the absolute support of my wife and I We are two Democrats living in the red state hell of Oklahoma perhaps you know one of our US Senators Senator Snowball We both strongly support you and are ready to take this message to the streets God speed Bernie ,liberal
what is your stance on the legalization of marijuana ,liberal
I m in Bernie I m in it to win I m helping wherever I can in St Petersburg FL and wearing my Bernie Speaks for Me shirt everywhere People are questioning people are saying they want you but you re a long shot I have challenged everyone that has said that to vote for you in the primaries so we can prove that money cannot and will not buy our government anymore I m an American and I won t tolerate it anymore ,liberal
I can t tell you how happy I am you are running You ve answered my questions when you started posting the TRUTH on Facebook I m proud of you and appreciate you I SEE YOU as the NEXT PRESIDENT of the UNITED STATES Go Bernie Go Make em FEEL THE BERN ,liberal
Please accept bitcoin donations ,liberal
Reddit call the banners We will put this man on the iron throne Er office ,liberal
Good luck ,liberal
Its been 10 years since I ve moved overseas but I ll be doing anything I possibly can using all my skills and all the spare time I have to make this happen When I move back to the US I want Bernie to be in the Whitehouse and America to be a better place than it was when I left ,liberal
I m so glad Bernie is running I went and made a T shirt to show my support and say loud and clear Enough is Enough You can get one too http teespring com support bernie sanders or pres ,liberal
dae le billionaires and corporations worse than satan xDDD ,liberal
I love how it s always a no brainer simple answer for Bernie No BS no run around ,liberal
People don t really understand how bad this is for national security Foreign intelligence services will be able to track the web surfing web searches and even the physical location of essentially the entire US population in real time The Russians will have a file on every American detailing all his online actions and every place he has ever carried a smartphone going back to his childhood This will make hacking surveilling and blackmailing US decisionmakers and other key persons in the US MUCH easier I m used to seeing terrible policy from the GOP but this is really something else ,liberal
Bernie gets it ,liberal
Its baffling to me that the 2016 presidential vote had a major candidate that was on the right side of every Major issue in the past 30 years and many People still dont know his Name ,liberal
I cannot upvote this enough ,liberal
I remember watching Inside Man the show by the that guy who did Thirty Days and the Supersize Me documentary EDIT Morgan Spurlock There was one episode in which he attempted to find out what information about himself was being sold online It took him forever to even find out where to go and he had to fill out a stack of paperwork just to see what information about himself was out there and when he got it much of it was blacked out It was fucking unreal This is OUR lives online and we don t even have the right to know who s buying and selling it Fuck that ,liberal
NSA CIA FBI ,liberal
It is terrible what the American deep state did do this man and now he must work for them Very sad ,liberal
The socialist thinks this while libertarian Rand Paul votes for it Wonderful ,liberal
Gonna go with some different asks today Consider the following Donate to the ACLU https action aclu org secure donate to aclu or if that s not quite your speed donate to CAIR https www cair com donations general donation campaign donation Also check out this post re the state of the sub https www reddit com r SandersForPresident comments 5r1era state_of_the_sub_130_civility_and_new_moderators ,liberal
Not to rain on your parade but Steve Bannon was a naval officer for 7 years has worked in the pentagon and has a degree in national security Say what you will about him he s definitely qualified The average person only knows that s he was the CEO of Brietbart ,liberal
Isn t the current intelligence community kinda responsible for some of our goings on in the Middle East and other shady shit Haven t done too much homework on this new guy but hopefully he isn t as bad ,liberal
the same security council seat that Hillary Clinton sold to some random guy ,liberal
Funny thing Sanders wasn t elected president so he doesn t get to decide who is on the National Security Council In order to do that you would need the support of the American people at the polls ,liberal
Godammit We had a real chance with this man A real chance to change the world for the better with a once in a life time candidate I will never forgive the dnc for this shit ,liberal
There was a time we thought house of Cards was fiction It s basically My Little Pony now ,liberal
Maybe if you didn t sell out after Hillary and the DNC cheated you America would respect you and what you say ,liberal
Ugh Just die already pinko old man ,liberal
Thanks for supporting Trump for president OP Great Job ,liberal
Voters deserve a chance to hear from candidates before they vote That s pretty simple and it shouldn t be controversial We think there should be a debate in New York before the primary Do you agree Sign the petition here www berniesanders com LetsDebate ,liberal
NYTimeNYWhere ,liberal
Wow Bernie be nice jeeeez s ,liberal
Looks like Bernie has forgotten about the time that he refused to debate in Florida ,liberal
Is it just me or didn t Hill say that Bernie didn t vote for auto bailout That bernie is a progessive that cant get things done Didnt she lie and say that he said anyone that voted for obama should get there money back ,liberal
This is one of the few times HRC came out in support of a position BEFORE Sanders ,liberal
Bernie is shootin straight flame ,liberal
She s going to debate him The two candidates are setting up a date as we speak Source one of her campaign staff on MSNBC about an hour ago ,liberal
lol all the down votes on this post ,liberal
It s almost as if the Hillary Campaign is still learning how to use the Internet These boneheads can t seem to understand that people will look up the shit she s said in the past ,liberal
Wasn t it 700 billion for the military ,liberal
Thing is only the government can fund the Pentagon I can and did pay for my own education ,liberal
I bet there is no money to help Puerto Rico and the USVI either ,liberal
Not to mention healthcare More and more Bernie is proving he s a senile hack ,liberal
And let s not forget what the president said at the UN he s using nearly 700 billion dollars to improve defense For comparison the US s defense budget last year was 60 billion I believe Feel free to correct me ,liberal
Well you don t have to be smart and educated in order to be able to shoot and bomb the shit out of brown people You just need weapons lots of them ,liberal
Priorities ,liberal
college was way too easy if college wasn t graded on a curve there d be far fewer students and much more scholarship money to go around we need to stop trying to make college available for everyone not everyone is fit to go to college ,liberal
if u want to live in a socialist country i am sure venezuela would love to have you seems like its working pretty well for them ,liberal
Because social security is going so well right ,liberal
At 7 ET Sen Sanders will be giving a speech tonight about the future of our country You can RSVP here https go ourrevolution com page s bernie speech source reddit Presumably they will send further information as it comes Edit Apparently this is the link to watch https ourrevolution com watch Edit 2 You d think they d have a better handle on digital streaming by now Edit 3 Try this https www facebook com georgewashingtonuniversity videos 10153961973555913 Edit 4 For the NeverFacebook crowd https youtu be 0YCmYY3Fa9Q Edit 5 ,liberal
Commie ahould be thrown from a helicopter ,liberal
Sanders 2020 Make America better again ,liberal
https www youtube com watch v 7JSgQf4fgtA stillBerning ,liberal
I miss you guys ,liberal
We have to re open this sub The members can handle the trolls We cannot let this group go to waste Shame on the mods for not allowing us to communicate in the best forum for communication with a group that NEEDS it now more than ever u writingtoss please help the cause and unleash us ,liberal
Please call your reps and area chairs and demand it ,liberal
Whoooooooo So exciting Bernie is everywhere continuing the fight On every news channel on his book tour in editorials 3 new posts to this subreddit I see hope We see the light ,liberal
The DNC s Record of losses Under Obama Kaine Wasserman Schultz https www reddit com r WayOfTheBern comments 5dye65 the_dncs_record_of_losses_under_obama_kaine ,liberal
So S4P is back up but only the mods are allowed to post one article every few days I m really hoping this is temporary They had to be pressured to even reopen the sub and now they re exerting rigid control without a transparency statement why Get out of the way mods let progressives PROGRESS ,liberal
This is what happens when you conduct a caucus where people raise their frigging hand to be counted and do coin flips when there is a tie What the hell is in the corn in Iowa ,liberal
Who are you people I used to caucus in this district I know the lady that does most of the talking in this video as well as many of the other people involved I ve known them for years professionally and personally I can tell you that there s no secret plot I would trust Liz Buck with anything even though I am on the other side of this particular issue I caucused for Bernie in my new district and it was more of a mess than this video for sure The people getting all tinfoil hat about this have maybe never seen how these things really work ,liberal
Nothing will ever come of this Hillary is the chosen one and all the leaders in the Democratic Party believe that it is her god given right to be president They re not going to do jack shit because they know that no matter who wins the primary in this case Hillary most of you suckers are still going to vote for her because she is the lesser of two evils This is why we have a two party system ,liberal
Of course the Clinton machine scammed the results They re top of the line liars and the MACHINE has bought so many people the only way the BERN has a chance is for her to have a stroke ,liberal
I really dont get this conspiracy gt FIRST VOTE gt 215 Sanders gt 210 Clinton gt 26 O Malley gt 8 Undecided gt 459 TOTAL Okay so that means 34 people were left and O Malley was seen as unviable so his people were forced to choose between Clinton and Sanders gt SECOND ROUND gt 232 Clinton gt 224 Sanders gt 456 Total 22 O Malley Undecided went to Hillary and 9 went to Sanders equalling 31 3 people probably upset O Malley fans left making the total smaller Even if you add those 3 to Sanders then Clinton still wins What are they trying to say proove ,liberal
Mehhh doesn t matter Even if Hillary lied and cheated and ends up with the nomination the vast majority of you will still vote for her ,liberal
Why isn t Bernie talking to the press about it I love that he hasn t gotten ugly with Hillary and all that but if it is shown that there were improprieties one of the outcomes could be wide discussion of getting rid of this method of voting ,liberal
I caucused for Bernie last night and I can feel for the people there The Iowa caucus is the most absurd event I ve ever been to I was packed in a grade school gym with 300 people and 69 chairs exactly 69 chairs that s what we were allocated After 30 minutes of normal business we herded into our corners for the count it was chaos This is a process that was clearly created when the horse and buggy was the dominate mode of transportation After the count and a subsequent recount and the shaming of the non viable caucusers we were able to escape after an hour and a half of being locked in a tiny room with 300 people I was then able to drive home and watched this live on CSPAN Quite honestly if I were there I would second giving all the delegate votes to Cruz at that point Why does this process still exist and why are we first ,liberal
And some of you might remember that Al Gore lost the election to voting rigging a while back Nothing new kids ,liberal
Also look at 1 44 The Hilary side asks people if they are a new supporter by asking if they were counted last time I wonder if any people who were counted last time incorrectly answered yes ,liberal
An abundance of interest in the moderator application Expect to hear more soon And some of the trolls were very funny ,liberal
Is this sub dead again ,liberal
cool but open the whole sub up again for the love of god ,liberal
So the human rights and civil rights of the protesters were violated but Obama was listening I get why Bernie puts it like this but let s be clear on something here Obama didn t do jack shit If you d told me even 6 months ago that I would one day despise president Obama I would not have believed it He s a disgrace good riddance to unprincipled garbage At this point we get the orange garbage bag in return for the sleek looking black garbage bag They both stink Oh and the oil company has not stopped drilling ,liberal
Did not realise this sub still exists Sanders should be prez Eff Hillary ,liberal
I love the verbiage of appreciate Damn right appreciate and not anything laudatory All of the violence that has occurred hitherto was unnecessary and rests on the shoulders of our corporatist president He took a few weeks to let things play out and now a woman is very likely going to lose her arm as a result Obama did what any person with a heart should have done months ago Again leaders never lead they follow ,liberal
OK is this sub back or is it not back ,liberal
Thank god for Trump see what s happening since he has been elected Pipeline called off jobs being kept in the country Truly a great developement ,liberal
I m sorry but this on off intervention is no difference than what Trump did with Carrier in Indiana Instead of corporate cronies it s just a different type of cronyism ,liberal
Shut up bernie ,liberal
It got mentioned on Fox News ,liberal
How can Bernie recover from this performance and his devastating win in WV ,liberal
Media silent Check the cover of the New York Times ,liberal
The internet is way slow there like 1Mbps up The news is coming it s just on it s way ,liberal
All the local news was covering it and would even stream the speech on their websites ,liberal
All ages shows don t count ,liberal
NPR is so biased towards Clinton I ve given them a nice check every year for years and they do this to me Clinton Clinton Clinton Clinton Clinton Clinton ,liberal
I m putting a site together to call attention to the biased reporting and media blackout If you come upon more examples please submit them to http media bias org I m a one person team so the more help I can get the better I m especially looking bot video examples that expose MSNBC and CNN hosts Bonus points for election night coverage ,liberal
now if all these people would vote ,liberal
I live in sac and didn t hear about this Looks like we need more people spreading the word I even searched here and some Bernie reddits for Sacramento the other day and didn t see this ,liberal
Damn sorry for never giving a shit about u Martin ,liberal
and then he went on and endorsed hillary ,liberal
Who s the racist asshole who referred to Hispanics as Taco Bowls in the leaks ,liberal
I hope people realize that Tim Kaine is the same kind of candidate Martin O Malley is just because he aligned himself with Hillary doesn t change his past nor his clean background ,liberal
Did he ever being said suit against the DNC ,liberal
Can these people get sued ,liberal
Sometimes I told you so Is bittersweet ,liberal
of course it was rigged she had all of the super delegates before the primary even started hillary rigged both of em democrat but also manipulated the republican primaries to choose the candidate they wanted to run against and rigged the dropping of her criminal charges this is her year no matter what I thought we already knew that ,liberal
BRO MALLEY ,liberal
I mean that accusation is probably made by somebody in every election ,liberal
Ugh here we go again ,liberal
Dont know if anyone has noticed but we actually won Marion County by almost 3 000 votes ,liberal
So may high information voters in here yet they don t realize that BS can t win over HRC because of the number of votes lol ,liberal
They just HAVE to mention superdelegates for Hillary creating this illusion that Bernie has less of a chance than what he really does Ugh ,liberal
Indiana resident here I knew he would win our state So happy he did ,liberal
Can someone explain what happened in Union County On the Guardian results page it was filled in by an official and it is greyed out ,liberal
What happens if he doesn t get the Dem nomination Does he not run at all or he runs as independent ,liberal
This makes me happy My brother implied that Bernie had already lost the Democrat election but seeing Bernie win Indiana is huge This makes me happy ,liberal
Just curious Do we have a total tally for votes cast for Hillary versus Bernie across all primaries ,liberal
removed ,liberal
If Bernie loses the Democratic primaries what are the chances of him running as independent i am a fairly new to politics ,liberal
I like Biden I really do If Bernie was losing again Biden I would be ok with giving him my vote Sad but ok with it There is no way in Hell I am giving a former Walmart board member who is married to a Third Way pioneer my vote though Out of the question I simply cannot condone that direction for the party ,liberal
link is 404 ,liberal
You the real OG Biden ,liberal
Article has been taken down here are alternative links courtesy of Reddit user GotoSander http webcache googleusercontent com search q cache FFYuPfp5ktwJ www kabc com news biden sides with bernie says he prefers sanders big ideas to grow dem party cd 1 hl nl ct clnk gl nl http www upi com Top_News US 2016 04 21 Biden sides with Bernie says he prefers Sanders big ideas to grow Dem party 8841461256113 ,liberal
Phonebank canvass material ,liberal
If he really has been preferring sanders ideas over Clintons then he really should have spoke up sooner ,liberal
Well yeah Bernie actually has a growth plan for the Democratic party not to mention his 50 state strategy DWS and HRC don t give a shit about drawing people into the party They prefer to actively exclude people It s why DWS has been a terrible DNC chair and an historic failure and has lost an unprecedented number of seats during her tenure and is about to lose her own It s why the number of Americans identifying as independents has skyrocketed The party is actively losing power and influence through losing and alienating membership Of course Joe Biden by virtue of not being an idiot would prefer to grow the party and attract new membership that supports the ideals the Democratic party claims to hold ,liberal
Broken link ,liberal
The page can no longer be found on kabc com Did Brock get to it in his fight against our democracy ,liberal
Imagine how the RNC might go https medium com homeland security cleveland has fallen e488a850a80 source linkShare b1881f615218 1463612001 ,liberal
Its ok donald can do whatever he wants to bernie and not hurt his chances because the left wing primary rules have already given this vote to Hillary Bernie got screwed ,liberal
Donald Trump Doesn t Give a Damn About His Supporters or anyone else but Donald Trump https anonmgur com up 12afe3e613363e3b09a825cf7324fd42 jpg ,liberal
https www facebook com breakthecage posts 2996418423916 ,liberal
