removed ,liberal
John Oliver noted a survey which found that Americans are the only people in the world who by and large vote for policies that go against where they are now but benefit them when they get rich in the future American dream delusion at its best I say if you re thinking long term like that put more money in your 401k it s likely to do more than voting that way ,liberal
This is Trumps Palm beach house he has others yes workers wages are too high he needs more https www washingtonpost com politics inside trumps palm beach castle and his 30 year fight to win over the locals 2015 11 14 26c49a58 88b7 11e5 be8b 1ae2e4f50f76_story html ,liberal
You re the liar actually The video cuts out the part where there is a question asked to Trump The question was along the line of will you raise the minimum wage So in the context of that question when he said wages are too high he was referring to the minimum wage specifically And more precisely he was speaking against the idea of raising the minimum wage because in the end it gives jobs to other countries Past a certain level you can t force the market to pay high wages it has to go through competition That s his argument So you re just full of shit like the so called reporters ,liberal
It s all part of Trump s master plan He isn t really running for president he s showing us how ridiculous the political system and especially the GOP are in this country https www youtube com watch v wAthK2FoHXo ,liberal
Donald Trump Wins Iowa 2016 Caucus https www youtube com watch v 5KJ3rAhmIpc ,liberal
Being honest means not taking peoples words out of context even if it does seem to be what you want to imply Trump was asked a question about the minimum wage That means you must assume his response is referring to the minimum wage if he doesn t specify Sanders then claims Trump says wages are too high without mentioning the context that this is referring to the minimum wage only Sanders knows full well that the mainstream conservative position is that the minimum wage is too high because it is government mandated and Sanders also knows full well that everyone in America on both sides supports higher wages in general Sanders WAS being dishonest here when relevant context is taken into account ,liberal
The DNC is not beyond redemption We just need to do everything we can to make sure Keith Ellison is the one spearheading the charge Support him today How you can help him https keithfordnc org howyoucanhelp ,liberal
They somehow got mine I have gotten a few emails from Nancy Pelosi asking for money ,liberal
Seriously the DNC just doesn t fucking get it If they get our emails and start bombarding us with spam will just unsubscribed from them in record numbers If we want to donate to them directly then will do that when they prove they can be the party of hope and change We know they propped up Trump we know the primaries were a coronation for Clinton and we know they went out of their way to undermine Sanders and make the value of our dollar less they have a lot of fucking work to do ,liberal
Thank You Bernie ,liberal
Another day another right wing rag upvoted to the top of r s4p This is not a progressive subreddit ,liberal
Getting an email from the democrats to raise money would just remind me to unenroll in their party Bernie is really helping the DNC here ,liberal
Lol remember when bernie had obviously lost in the primaries but he kept going for months raising millions of dollars and not spending it so he could give it all to hillary in the end ,liberal
Good for Bernie ,liberal
The only reason I changed myself to a democrat from an independent is so I could vote Bernie I m never voting for any democrat ever again How could I ever give my vote to such a clearly corrupt body ,liberal
Run DNC it s not tricky ,liberal
The truth is simple During the first two weeks of April Clinton has scheduled more than 20 of these high dollar fundraisers Why Total raised in direct contributions to each campaign until March 31st Bernie Sanders 182 195 654 Hillary Clinton 176 503 224 Plain and simple HFA is desperate Clinton s billionaire backed campaign is being out fundraised by millennials who don t research Last month she spend nearly 33M and only brought in 29 5M and as we enter the most expensive media markets in the country she s dumping in 900 000 https twitter com meetthepress status 718186958023954433 worth of ad buys in her home state where she s supposed to be cruising with wide poll margins Well those margins are closing and we can very well run her dry out of cash She needs to rely on big money events like this one just to stay afloat whereas we are changing the game altogether She s gotta resort to hiding her speeches to rich donors by blasting static noise while Bernie speaks openly of the change we ,liberal
Lmao oh my christ this shit man Seriously This Shit Can t believe how nuts this election season is ,liberal
Why am I not seeing anyone question whether this is actually legitimate First it s alleged and from the video evidence I m not even close to being convinced You could edit in post or even just fake static on your own it s extremely easy I find it very troubling that people just take this and run it as fact For fuck s sake is critical thinking and scepticism just gone out the window ,liberal
Apparently Hillary campaign speeches are now hidden behind a paywall ,liberal
In contrast Bernie s entire platform could be considered White Noise Grasp Moar ,liberal
More than decyphering the audio CBS will likely also have experts take a stab at cleaning it up we need to get this story out to MSM not on the far right which currently is all that is carrying it The Washington Post does have it https www washingtonpost com news powerpost paloma daily 202 2016 04 08 daily 202 bill clinton s argument with black lives matter protesters is 2016 s sister souljah moment 570675c2981b92a22ddf2fd2 but it s buried way down as a couple of paragraphs in the Daily 202 well after Bill Clinton s BLM whitesplaining and Hillary s subway ride search the page for noise and you ll find it Twitter is not the only place to make sure this gets covered Hit the comments on the MSM sites for any near relevant story and ask why they are not covering this one Point them at the CBS affiliate s tweet https twitter com StanBushTV status 718237718191480833 and ask them to ask Hillary why it was so important that nobody know what she said to her high dollar funders ,liberal
This is like some occult level shit lol ,liberal
Why is this not a bigger issue None of the MSM are reporting anything as far as I can see ,liberal
HillarySoNoisy ,liberal
Great behavior from someone who says let me be clear so much it should be a drinking game ,liberal
Al Gore tries to remain relevant His new climate change movie looks terrible mainly because how he frames it It also will probably play to the same crowd rather than doing anything relevant ,liberal
To be honest this seems reminiscent of the Republicans voting to repeal the ACA 2 4 years ago when they were in the minority If this were to actually come to a vote with any realistic chance of passing then we d see who actually believes in pursuing the Single Payer option We are seeing it now with the Republicans pushing for a full repeal of the ACA already 8 Senators who previously voted for the repeal bill have stated they would not support it now they were effectively grandstanding granted maybe their opinions have changed in 2 4 years but that seems rather unlikely ,liberal
The party has moved further left and Hillary got left behind somewhere in the middle ,liberal
ELI5 single payer ,liberal
What leadership ,liberal
What leadership Leaders lead If you re not for universal healthcare you re a follower and what you re following is what private health insurers want you to follow their lies and their money ,liberal
Can someone please convince Al Gore to run for president next time We are running out of time ,liberal
The American challenges of this era oligarchy plutocracy climate change healthcare ,liberal
I love that s it a big deal to support the most logical healthcare system ,liberal
Paid for by the 50 trillion national surplus we have because of the policies Gore implemented after being chosen by the people in 2000 to be President and being allowed to serve ,liberal
OUR PATH FORWARD 1 California s voter registration deadline is in 5 days See this post for information which will direct you to where you can register check your registration find your polling place and more https www reddit com r SandersForPresident comments 4hsdl4 complete_california_presidential_primary_voting 2 Attend an upcoming rally or campaigning event Search for upcoming events near you at http map berniesanders com 3 Knocking on doors is the single most influential thing you can do at this stage If you can make it to CA MT NJ NM ND or SD visit www BernieSanders com Organize 4 If you cannot make it to an upcoming state join the rest of us in making phonecalls Visit www berniepb com 5 Donate This campaign is funded by millions of small donations from working people across the country As Bernie has said this is a movement of the people for the people and by the people We are the movement let s push it forward www berniesanders com reddit ,liberal
We are all with you until the end of time ,liberal
This got me so fired up Listen to the man and PHONEBANK We really can make this happen ,liberal
Bernie please run as an Independent Please ,liberal
Can someone explain to me The Donald reddit I work too much to actually give a shit Also voted this primary for the gentleman from Vermont ,liberal
I am going to try to step up my phonebanking this weekend ,liberal
We got your back Bernie ,liberal
We have never been stronger thank you bernie ,liberal
Thank you for inspiring us Senator Sanders It s an honor to be a part of this revolution ,liberal
Bernie I hope someone in your campaign has time to read these comments Maybe the esteemed founder and minister of silly walks himself who I do miss reading here Aidan As a boomer hippie when young and now hippie at heart lifelong progressive your campaign has inspired me in ways too numerous to mention I know you know but Sanderism is now a movement that will go forward for decades and will blossom far into the future you have inspired millions to re think politics and opened eyes to harsh but imp to see realities LOVE Respect YOU FOREVER thank you with all my heart ,liberal
In California no ID required a person just has to show up to register state that they are a citizen and presto they re entitled to vote Isn t the honor system for determining citizenship heartwarming Those democrats are just so generous with voting privileges it almost seems like they re inviting illegals to vote ,liberal
How do you unregister in a state I m sure I m registered in two states because I moved from one to the other without unregistering I did not vote twice either ,liberal
That s how he knew ,liberal
This is some Boy who cried wolf journalism If they keep reporting on non issues people are going to start ignoring them even more ,liberal
you mean woman and her campaign of questionable actions during her election who fueled trump voter fraud conspiracy oh shit i just realized sub i m in gonna leave this here even thou i know the outcome ,liberal
This is what we call projection ,liberal
We keep letting him dictate the conversation This voter fraud discussion isn t a thing We need to hit him where it hurts not get suckered into discussing each and every lie He s committed a ton of atrocities since the voter fraud allegation Let s talk about firing the acting attorney general for doing her job and replacing her with a Yes Man Or better yet let s stop talking at all and call our representatives ,liberal
Sure but that s just 6 of the states barely statistically significant s ,liberal
Lol and that s illegal how ,liberal
Who cares Did he vote in 3 states ,liberal
I m just trying to give credit where credit is due Alec Station ,liberal
As a human I can see why this belongs on r comedycemetary ,liberal
How is this even remotely funny ,liberal
Yes ,liberal
Since that dinner where Obama made fun of him his feelings have been hurt That night he decided to destroy Obamas legacy All one has to do is look at his to do list Taking back DACA regardless of whether it s set in stone or not Obamacare wanted it destroyed Repealed and replaced and then in the end JUST repealed with no plan Removal at any cost regardless of who it harmed in the nation The transgender ban something Obama set during his presidency he s removed via a fucking tweet Gay marriage happened nationwide under Obama We will see that fucked with when Russia flares up again He doesn t care about the country only in seeing everything Obama did removed from Washington The lies he said to the LGBTQ community the lies that he loves the dreamers the lies about a wall that ll never happen this is all to fuck with Obama So him finding Osama and fishing him out isn t beyond the realm of possibility to me ,liberal
While I like trump this was pretty funny here take an upvote ,liberal
yeah this already happened basically remember when he sold ksa all those weapons ,liberal
Edo Tensei ,liberal
You don t need to revive him to bring him back ,liberal
removed ,liberal
People will remember that and officials would be newsworthy ,liberal
On April 20 a month before the story ran Butowsky and Wheeler the investor and the investigator met at the White House with then press secretary Sean Spicer to brief him on what they were uncovering It seems like if Wheeler the guy who was misquoted and is now suing about it was present at the meeting it probably doesn t make sense to conclude that the meeting shows White House collusion in the lie This could have gone down like Spicer Hey long time no see What re you up to Butowsky we re looking into who murdered Seth Ritch Spicer hoo boy you catch em yet Wheeler nope Spicer dang Well how s things otherwise You see that sports game the other day Ok now maybe Spicer called Butowsky up the next day and said he should lie about it but Butowsky could have just decided that on his own too right ,liberal
The orange is spreading If you re close to Trump too long you risk exposure ,liberal
Let s not forget the Bernie or bust crowd pushed the same narrative a year ago ,liberal
MSM might actually spend more than two minutes on the stage because I know what it means ,liberal
No more Mr Spice Guy ,liberal
Ok What now ,liberal
The conspiracy is coming from inside the house the White House ,liberal
They set spicey loose now he s out for blood ,liberal
RawSewage is cancer ,liberal
removed ,liberal
removed ,liberal
removed ,liberal
removed ,liberal
What about that one time he put Dijon Mustard on his sandwich guilty mf ,liberal
He did have scandals but like at very most every few months to a year He wasn t the constant weekly scandal train of death were on now ,liberal
FYI Controversial scandal ,liberal
removed ,liberal
The Blueprint ,liberal
Oh I thought it said 0 sandals I was picturing Trump in birkenstocks ,liberal
How can it be free press when they ve chosen a political side instead of being objective ,liberal
Excellent time to subscribe to a newspaper ,liberal
HRC was just as shitty Proof Goldman Sachs speaches ,liberal
Ummm are you sure about that I m by no stretch of the imagine a republican but this video https www youtube com watch v V1ulkykn7jc makes a strong point ,liberal
What is he doing outside of Tweeting ,liberal
Most mainstream media was full of garbage long before Trump was president he s just the first one to say it ,liberal
Free press that promoted one candidate while pouring shit on the other LOL ,liberal
The American press isn t free it s owned by six corporations who control everything ,liberal
zero fucks were given ,liberal
This is great news ,liberal
What would you estimate that Trump is going to be impeached ,liberal
I m an independent who saw this on r all I m usually on the fence politically and just want what s best for our country I m rooting on President Trump to succeed since he s in charge I don t like or hate him However this is ridiculous Why lie about golf They could have said he was having a golf meeting I ve done it Plenty of business owners do it How dumb EDIT I m confused now I went back to the page and hovering over the photograph it says 2015 from SCOTLAND Is this fake EDIT 2 YEP 100 fake BS again UGH So sick of this crap getting to my r ALL Trump Turnberry Address Turnberry Ayrshire KA26 9LT United Kingdom ,liberal
A lot of deals can take place on the golf course and their is nothing wrong in that to the people complaining about the post the problem is not that Trump is playing gold the problem is the fact that white house representatives lied Why the lie ,liberal
I don t mind him playing golf It keeps him away from the nuclear codes ,liberal
That shit eating grin on his mug lord ,liberal
removed ,liberal
Dailykos guys The first line calls an inanimate object racist there are so many things wrong with Trump this is all you ve got ,liberal
This just in Donald Trump is lying sack of shit details at 11 ,liberal
Well bust out the big box of crayons and color me shocked ,liberal
Lol You don t care ,liberal
Were those really the best examples of Patriots he could come up with Because they didn t exactly have a problem with white supremacy ,liberal
Can you direct that comment at the White House governor Someone on Pennsylvania Avenue needs to realise he is energising these individuals ,liberal
I literally logged in just to up vote this ,liberal
Well they support a man who marginalized the suffering of a POW from a war whose draft he dodged by claiming he has painful bone spurs ,liberal
Wake the fuck up America There is some seriously fucked up shit brewin within ya ,liberal
removed ,liberal
Is there some group I can join which protests white nationalist which also isn t socialist communist anarchist antifa Is there some sort of down the middle everyone just cool your shit group ,liberal
Republican hate kills ,liberal
I thought referencing Thomas J as a shining point of light had gone out of vogue he systemically raped his slaves while he brought our country together Must admit was nearly moved to tears when the Gov said Shame on you He means it When that admonishing is delivered effectively there s little worse ,liberal
Call them what they are terrorists ,liberal
Ongoing for a decade B b Ut Trump Apparently Obama too And Bush ,liberal
Hey i get this and itoo was pissed but what i cannot find is a data set of information about the secret service and their fiscal financials HAS THE secret service EVER run out of money with other presidents I want to hate Trump here just like the next person BUT can someone investigate and pull this information What if Every president has had this issue Maybe not as quickly or maybe not at all But i feel like this can t be the first time in history that the secret service ran out of money ,liberal
They aren t bankrupt There is a limit to what you can pay secret service employees through a fiscal year It just so happens that other presidents have run into the same problem This is because it s hard to know the total number of trips you will take where you need protection What trump has done is poorly manage the budget by hiring too many agents AND going on too many trips in a shorter time span than have other presidents This isn t news and doesn t tell us anything we don t already know about trump ,liberal
Secret service is about to run out of money because their fiscal year ends in September It s August So yeah they ve gone through 90 of their budget in 11 12 of the year ,liberal
That s basically all the CIA has to do now babysit Trump and his extended family I m so sick of all this winning ,liberal
Related Are the people who delete his previous tweets paid for by the taxpayers ,liberal
Am I allowed to complain about both ,liberal
Where are they How about in this thread All over facebook ,liberal
There right here and on the news It s a mirror situation ,liberal
It s because of all the nice things trump has to say about general Lee cancels out all the promises he can t keep Dumb people really have a hard on for general Lee ,liberal
The Republican are falling the USA ,liberal
Why are most of the top level comments here by alt right posters and the_donald regulars ,liberal
i dont much care for trump but what in the fuck do people expect him to do bail out the city with a trump bucket ,liberal
Catastrophe everywhere and democrats are busy bitching about the first lady s shoes ,liberal
deleted ,liberal
deleted ,liberal
removed ,liberal
removed ,liberal
Yeah but there s no votes to be had for Republicans in either place ,liberal
Lmao ok ,liberal
Where s all the winning I was promised winning ,liberal
First time in history Republicans pull out to avoid giving birth to a disaster ,liberal
So now they can work together and come up with something better that s great news Rand Paul has a plan that s only 4 pages long I hear maybe they should look deeper into that ,liberal
deleted ,liberal
The Cheeto s group reaction right now they re in control they can get more out of reach for over half the country has improved since inauguration ,liberal
Surprised face ,liberal
removed ,liberal
removed ,liberal
I don t understand why republicans care I ve looked at the evidence and the predictions from people on both sides and I m inclined to agree with them when they say ACA is going to collapse They stripped it of important parts yeah but the blame would be squarely on the left if it does If it stays and it does implode on its own then the working class are going to take their votes elsewhere in 2018 and 2020 like they did in November If it s capable of surviving then the republicans can just ease their own system onto it using the ACA as a framework in their own image It should be a win win to wait it out for another year and just say they want to do it right ,liberal
The cheeto bills himself as this great negotiator The best I mean put him in a room and deals get done kind of guy We come to find out he can t pass an Obamacare repeal His negotiating tactics seem to be sending out whiny tweets There s a reason this clown has had to file bankruptcy 4 times And it s not cause he so smart and gaming the system It s cause he s a clusterfuck of moronic capability with a kings resources Trump only knows how to cock it all up Negotiator please This guy s a Russian stooge on his best day ,liberal
Honestly they need to face criminal charges if they knew he was a Russian stooge and nominated him and got him elected anyway They could have invoked emergency replacement rules staged a convention coup there are all kinds of ways to ignore the voters They knew he was unfit and they knew he was in Putin s pocket ,liberal
No audio no saideo where s the audio ,liberal
He was probably being sarcastic Ive never met a Republican that got sarcasm but they have to exist right ,liberal
Does Paul Ryan think he is the Godfather ,liberal
GOP Party of the Corrupt Don t believe me Look up the amount of scandals on each side of the aisle GOP takes the cake pretty easily ,liberal
what s said in the family stays in the family GOP confirmed for literal mafia ,liberal
I hope Trump is stupid enough to take the GOP down with him ,liberal
Could anyone explain why the Post wont just drop the audio ,liberal
removed ,liberal
Oops ,liberal
Here is the full report referenced in the linked article https www brookings edu wp content uploads 2017 10 presidential obstruction of justice the case of donald j trump final pdf ,liberal
I ll believe it when I see it ,liberal
but will you guys actually get up and do anything about it who knows ,liberal
The Brookings INSTITUTION ,liberal
but he wont be because ruplublicans are party over country ,liberal
I don t care what side you vote for we need a government that obeys the same rules applied to us all This won t happen from across the bench People need to stand up in their own parties and cut this competitive bs that characterizes our political system Having the courage to do what s right is a principle that all Americans should uphold ,liberal
I wish I really do but I ll believe it when I see it ,liberal
Dont get your hopes up if i had a dollar for every time ive read x could get Trump impeached ,liberal
Lol I m sure he will be impeached ,liberal
Likely could be ,liberal
Was it illegal for Pruitt to do so IDK I would venture to guess it was illegal for Pence since he was discussing homeland security He AND HRC should be behind bars ,liberal
removed ,liberal
Wow this Russian conspiracy sounds like more and more of a witch hunt every day Even if you hate Trump he says a lot of things that are true ,liberal
removed ,liberal
Guys there are laws It isn t against the law to use a private email address in that position plz don t present the left as this stupid and out of touch ,liberal
Yeah and like Hillary he should be absolved of anything despite the evidence ,liberal
removed ,liberal
Do not use Hillary as a lynch pin for justice Use the law ,liberal
All politicians lie If lying will get you fired then we should send them all home If lying will get you fired I have a feeling a lot of us would be unemployed The liars in the Senate accusing the liars in the Administration being arbitrated by the liars on the Supreme Court is kind of a farce ,liberal
Is there reason to believe classified information was transmitted using the private email address ,liberal
This thread has been locked because of heavy brigading from unfriendly subs ,liberal
Fuck the corporate dems buts this is good news ,liberal
I don t know if you guy realize that Ivanka is a Democrat ,liberal
Cause they re not made in America Trumps orders ,liberal
Nice bro That is REALLY changing the world ,liberal
Guess that s paddlin ,liberal
