removed ,liberal
All businesses should have a bright yellow D or R by their front doors and websites ,liberal
Her clothes were shit anyways ,liberal
The clothes weren t selling That s why they dropped it ,liberal
Although the protests don t seem to be working politically It s evident that the movement is powerful economically ,liberal
removed ,liberal
Yes basically they are racists all Of them ,liberal
removed ,liberal
They care about unborn babies and rich people ,liberal
removed ,liberal
removed ,liberal
Republican party officials only care about keeping their jobs and staying in power They are all talk especially when Obama was President and action I m really disatisfied with the Republican Party I m glad I m registered Independent I wish Trump would keep his promise and leave NATO Close our bases overseas We need to cut our Military by 90 I m an army veteran of OIF and hate the war machine Why do so many people want a rediculous large military We have two large oceans Canada and Mexico surrounding us Let s focus on taking care of our country Stop meddling in other countries We are bankrupting ourselves with military expenses ,liberal
Democrats now have option to promote universal care and maintain private insurance Not doing it to oppose unpopular orange person Politics mean issues not issuing meanness Get the policy and raise the tide ,liberal
They care about what I care The title should be fixed to Less caring to liberals perhaps to be accurate ,liberal
removed ,liberal
My honest hope is that Trump fucks up everything so bad that Democrats win in massive waves and actually pave a way for single payer healthcare A pipe dream I know He s just going to fuck everything up and be done with it ,liberal
Somewhere deep inside his fat orange ass is a serious health care plan Let Paul Ryan dig it out in Trump s toilet ,liberal
His first day is gone and I ve still got 11 more days to register this year for Obamacare ,liberal
Still better plan than Obamacare ,liberal
r noshitsherlock ,liberal
Because of course the plan has to be published and implemented 2 hours after the guy gets inaugurated Do you fucking morons understand why the world hates you ,liberal
Oh I see I know that Obamacare does specify that pre existing conditions can t disqualify you from coverage I didn t realize that it helps less with prescription costs ,liberal
Obamacare WAS the Republican plan ,liberal
Then obamacare has to stay ,liberal
Time to touch up on my Victoria 2 gameplay and bootstraps I don t want to end up in a debtor s prison in Trump s America ,liberal
Wait until they figure out what a gigantic piece of shit Donald Trump is ,liberal
Well to be fair just because someone is a huge troll and loves controversy doesn t mean that it should have been assumed that he wanted to be able to fuck 13 year old boys This was a whole other kind of shitty person that no one saw coming ,liberal
Democrats suddenly oppose pedophilia ,liberal
I m incredibly furious about this because for years now people have been saying well you have to give Milo a platform because free speech and now suddenly they re in agreement that he should be dropped by CPAC So basically they never actually believed in absolute free speech at all they were just specifically okay with racism misogyny homophobia transphobia doxxing and harassment They accept that some things are not up for debate but think the basic humanity of women and minorities is one of the things that is Oh and this isn t even news we ve known about Milo and paedophilia for years He supported Gamergate when they were running out of a child porn site and posted there and people still insisted he be allowed to speak at universities only backing down when he made the respectable conservatism of CPAC look bad ,liberal
Lena Dunham molested her little sister and you praised her ,liberal
removed ,liberal
Milo was axed from CPAC because his words impacted people in their sphere They were fine when his words harmed those outside of it https mobile twitter com Christiana1987 status 833754730434211841 ,liberal
It s almost like maybe the hate speech guy had some poor views ,liberal
Well it didn t take long after the right wing conspiracy theory factories started in on pedophilia as a way to attack Dems for evidence to start emerging that the right has worse pedo issues They re going to have to find a new genre of attack fiction now ,liberal
I only saw Milo for the 1st time on Bill Maher Never saw him before but just read about him on Reddit previously My initial thought was that Maher and him agree on free speech My next thought was its best to ignore this guy and not front page him Ignoring him kills everything he seems to relish ,liberal
I think Harrison had a bad start ,liberal
Donald Trump is the Mississippi of Presidents ,liberal
It s all going to be all right folks It may take awhile maybe even a long while but we re going to be all right If we don t lose heart This It s so easy to be disheartened by all of this to believe that nothing will get better Even I fall victim to that sometimes But we can t lose hope The case for impeachment is building even as I type this and Trump is panicked Most everybody in his administration knows what to do and every time they try to help Trump they end up damaging him Nunes as a key example Keep calm and carry on The United States of America and us will survive this ,liberal
Given that Abraham Lincoln started his presidency with the Civil War its a best the second worst ,liberal
Would Rather prefer that Trump not be defeated in enacting his legislative agenda This feels like a bit of a reach ,liberal
And none of that makes a damned bit of difference as long as the entire country just sits back and takes it on the chin ,liberal
Look at these fucking idiots try to justify this shit They have fucking cartoonists as their defenders http blog dilbert com post 158812654486 trump and healthcare ,liberal
So much winning ,liberal
removed ,liberal
Hell even Buchanan had to wait til the summer for the Panic of 1857 ,liberal
alright ,liberal
So you re saying you believe oil executives are looking out for the best interest of the corruption Yes I m following the money and all the senators politicians that are climate deniers are backed by big oil sooo ,liberal
Does that mean they will actually read the articles finally Because I get the feeling they don t usually actually look at the data ,liberal
I m deeply unnerved by these changes I worry that at the moment people will hide behind the this is just a temporary measure until the transition to a new administration is over excuse and several months from now it will just stay as the current policy and journalists will have waited too long for it to become a widespread news item If you re concerned about this sort of thing too consider participating in the r MarchForScience when it gets off the ground ,liberal
This reminds me of the government minders on the Red October Trump Bannon doesn t want anything to get past the minders but how are they going to silence the social media accounts ,liberal
What s next a new branch of the military the political officer branch Assign a loyal trump supporter at every level of the military to ensure total loyalty Yes I ve seen this before somewhere Hmmm ,liberal
Can anyone point to some sources on this ,liberal
I this like thought control ,liberal
Reminds me of Atlas shrugged ,liberal
All science should be screened otherwise we ll just fall victim to the inherent faulty nature of statistics ,liberal
The Republican operative in Florida received a trove of Democratic documents from the allegedly Kremlin linked hacker Guccifer Jesus what shitty journalism ,liberal
Isn t that a firing squad ,liberal
Hurt her Dems how What did the hackers uncover ,liberal
removed ,liberal
It s bigger than Trump it s some GOP strategist ,liberal
After a young Earth creationist thug inexplicably wins in Montana Republicans clearly believe that nothing can hurt them Their 30 year effort to brainwash enough useful idiots into unquestioning illogical support no matter what crimes they commit has worked ,liberal
I see T_D has decided to provide evidence that this is all fake ,liberal
removed ,liberal
It d only matter if they were to find Paul Ryan s spine at the same time ,liberal
removed ,liberal
No take backs ,liberal
                ,liberal
Here s a response for people trying to discredit James Clapper Here is the clarification from James Clapper Well it might be useful first to explain the unique position that the FBI occupies in that it straddles both intelligence as a part of the intelligence community and law enforcement My practice during the six and a half years that I was at DNI was always to defer to the director of the FBI be it Director Bob Mueller or Director Jim Comey on whether when and what to tell me about a counterintelligence investigation when the possibility was there that this could devolve into some sort of a criminal investigation So I left it to the judgment of the FBI and that was certainly the practice I followed here But that was consistent with what I did during the whole six and a half years So it s not surprising or out of or abnormal that I would not have known about the investigation or even more importantly the content of that investigation So I don t know if there was collusion or not I do,liberal
Everything the Clapper says is a lie so I guess Trump must be actually telling the truth on this one ,liberal
So Clapper lied under oath ,liberal
We are not spying on the American public Clapper ,liberal
Hahahaha ha they re just pissed he fired their buddy comey ,liberal
Who are you going to believe Me or your lying eyes ,liberal
That s interesting he s said on the record there is no proof of collusion between Trump and Russia under oath on video less than two weeks ago https youtu be 7bqzEpRR4n8 ,liberal
Clapper shouldn t have much credibility either way he is the one who lied about the NSA ,liberal
removed ,liberal
cringeanarchy ,liberal
removed ,liberal
deleted ,liberal
removed ,liberal
removed ,liberal
PLEASE MODERATORS please do not delete any comments I would like each one to be seen Please please please ,liberal
What will the left say about Bill Mather ,liberal
removed ,liberal
I was politically organizing since before you had hair between your legs buddy And no the GOP does not condemn this as terrorism ,liberal
At least he s not trying to start a war with Russia Quite the opposite actually ,liberal
WaPi unfit to inform ,liberal
removed ,liberal
I think he has kind of mellowed lately ,liberal
The Republican Congress is not all that fit to serve either And the FBI needs to be thoroughly purged This is the guy who wanted Hillary Clinton jailed over using an improperly secured mail server He committed sedition he and the President conspired to cover up his treasonous acts and no one wants to even investigate it How many hearings were there into the emails non issue ,liberal
removed ,liberal
removed ,liberal
Lol ,liberal
removed ,liberal
But Trump IS fit to serve boiled cabbage shchi in some Russian gulag ,liberal
Videos in this thread Watch Playlist 9654 http subtletv com _r6u30eg feature playlist VIDEO COMMENT Dave Chappelle The Black White Supremacist Full Video http www dailymotion com video x3a3f0f 78 https www reddit com r democrats comments 6u30eg _ dlpj14w context 10 dlpj14w A Black Republican finally figuring out that Trump is a bad choice for a leader There s a Dave Chappelle skit in there somewhere Revisit Clayton Bixby here and it s defintely worth viewing if you haven t seen it Bee Gees I started a joke http www youtube com watch v fkG4oIPT7tU 9 https www reddit com r democrats comments 6u30eg _ dlq6c1t context 10 dlq6c1t Suicide Squad trailer At least credit the original Cosmic Slop Space Traders http www youtube com watch v y6 n9axdiOs 1 https www reddit com r democrats comments 6u30eg _ dlpwuy2 context 10 dlpwuy2 More like cosmic slop status Key Peele Black Republicans http www youtube com watch v G2tLyqfJd54 1 https www reddit com r democrats comments 6u30eg _ dlr0fb3 context 10,liberal
This guy s either dumb or just some actor I just saw him defending trump last night on MSNBC ,liberal
This is clearly fake news it depicts a Republican with a conscience ,liberal
People aren t getting the problem here Trump has points The Left has to take those points not leave them to smoulder You don t take them by simply denying them Look this problem is part of what got Trump in just as it s part of what gave Bush his war The righteous Left is digging another grave ,liberal
How the hell can any person of color be paid by Fox News and still manage to look themselves in the mirror Everyone whores themselves to a degree now and then but christ if you re black and working for Fox News I mean jesus man I hope they re paying WELL ,liberal
Breaking news you re a fucking idiot ,liberal
The Five was the most tense I have ever seen them The cameras went to the only black male in the panel Juan Williams He only relayed to everyone in the studio how he had cried with others he knew He literally had nothing else to add ,liberal
RINO ALERT ,liberal
Serves him right for betraying his people by being a trump supporter and republican in the first place The gop only has one back that they cover corporate donors ,liberal
It takes a lot of pride to swallow to when you re a Fox contributor to do something like this I know many will wonder why he didn t see it sooner but self delusion and confirmation bias are a bitch Thankfully he and hopefully others are now able to see Trump for what he really is ,liberal
Honestly if Trump was a stupid as his tweets would lead you to think he wouldn t be a billionaire and the president of the United States ,liberal
And he s still beating Democrats How embarrassing for Democrats hahahaha ,liberal
Well guess who s not going to be his biographer much longer ,liberal
It doesn t mean smart evil people aren t goading him at the right times ,liberal
The president after him will be though And Trump will have shown just how much you can get away with and face zero consequences ,liberal
I believe Trump received advice all along for his campaign including tweets It s coming from Russia not saying necessarily the government That s why its of the radar to us ,liberal
He is enabled by people who ARE smart enough for that ,liberal
He s like that idiot who plays poker for the first time keeps going all in and keeps sucking out on the river only to win at the end thinking he s the best poker player in the world ,liberal
We know ,liberal
deleted ,liberal
r esist is a sub dedicated to compiling resources and fostering discussion to help resist the damage the Trump administration and those enabling it are doing to our country and the world If that sounds appealing to you please subscribe look at the information we ve compiled so far and help us by offering more Also please check out our wiki https www reddit com r esist wiki index and our twitter https twitter com redditresist R esistance is necessary I am a bot and this action was performed automatically Please contact the moderators of this subreddit message compose to r esist if you have any questions or concerns ,liberal
The fact that gerrymandering is even allowed is absolutely staggering ,liberal
I m half white dumbass Your opinion doesn t matter and claiming moral superiority isn t gonna fly Move along with your 3rd AltReich self ,liberal
Left NC for Alabama Not sure which is more backward anymore ,liberal
When Francesca Ramsay did a video on this on YouTube it had a 20 1 dislike ratio Fuck racists ,liberal
To this day I can t understand how Gerrymandering is at all legal when not for racial reasons ,liberal
BREAKING NEWS Water found to be wet ,liberal
So we recognize it Now what will they do about it ,liberal
No mother fuckin duh ,liberal
Shocked I tell ya Just shocked ,liberal
r esist is a sub dedicated to compiling resources and fostering discussion to help resist the damage the Trump administration and those enabling it are doing to our country and the world If that sounds appealing to you please subscribe look at the information we ve compiled so far and help us by offering more Also please check out our wiki https www reddit com r esist wiki index and our twitter https twitter com redditresist R esistance is necessary I am a bot and this action was performed automatically Please contact the moderators of this subreddit message compose to r esist if you have any questions or concerns ,liberal
Goldleaker He s the man the man who s incompetent And incontinent Such an old leaker Beckons you to kneel in his stream of sin But don t go in Golden drops he will drip on your head But his lies can t disguise what you dread For a Moscow whore knows when he s pissed her There s a hint of asparagus from Mister Goldleaker Pretty girl beware of his love of gold The puddle is cold Golden drops he will spray in their face And his lies can t erase their disgrace For all Trump voters ignore that he d pissed them They just say its raining and cheer for Goldleaker Do you expect me to stop No Mr Comey I expect you to uh uh you re fired ,liberal
The worst part of it is that he probably leaked this top secret info solely to distract the media from the Comey firing and fallout It worked I guess ,liberal
General McMasters just demolished the fake news narrative being pushed by WaPo A few of his responses in today s press briefing that absolutely destroyed this bullshit narrative RE WaPo Hit Piece The WaPo story combined what was leaked with other info and then insinuated about sources and methods I want to make clear to everybody that the Pres in NO WAY compromised any sources or methods in the course of this conversation RE Allies That conversation was wholly appropriate to the expectations of our foreign partners RE Aviation Information Information on the topic of the threat to aviation was shared with multiple allies and there were already multiple policies put in place against that threat And you and many others have reported widely on this RE Naming of City It s nothing that you would not know from open source reporting in terms of a source city of concern It had all to do with operations that were already ongoing and had been made public for months RE Leaking to the Press Those v,liberal
You do all realize that he s won so he doesn t give a shit He already has his trademarks in China I dare any of you to try and take those away ,liberal
Any evidence Or are you going to believe the Washington Post and an unnamed source again ,liberal
I m ready to be marching and protesting on the streets of DC However I m on the west coast Does anyone have contacts with organizers in DC that I can get in touch with ,liberal
Tump is just keeping his campaign promises When Trump said I WILL SURROUND MYSELF WITH ONLY THE BEST PEOPLE he meant Russia s best people ,liberal
This has already been debunked https i redd it bqn84ionltxy png No classified info was shared No law was broken Don t let the faux outrage distract from the Seth Rich story ,liberal
And now 45 is stating he has every right to tell anyone he wants classified information Technically true this wasn t about legality it was about the political issues involving WHO he told and what The information had not been made available to close US allies but 45 released it to a representative of a country that the US is contentious with ,liberal
If you want to let relevant representatives know how you feel about this use this toolkit to contact key members https trumpcaretoolkit org Update per Twitter Freedom Caucus chair Mark Meadows now says he is 100 confident this exemption will be taken out of the bill https twitter com pdmcleod status 857246989641273345 I guess the calls are working Keep it up folks Update 2 apparently the Freedom caucus is now on board with the revised AHCA apparently without the exemption Time to let the moderates know we still don t support this awful bill with or without the exemption Check this site for more info https 5calls org issue reckLlSWncCOUjUed Update 3 apparently they aren t going to remove the exemption UNTIL THE AMENDMENT PASSES https twitter com alikodjakNPR status 857312706151559168 ,liberal
this deserves jailtime honestly 1 year in jail for everyone involved with this not unresonable ,liberal
Why am I not surprised democrats and republicans alike wanted and got the same thing when the original ACA was passed God I am so sick of the holier than though hypocritical and crotchety politician ,liberal
28th amendment needs to be added to the constitution people No member of congress shall pass laws that don t pertain to them Of course we would have to figure out how to get that same group to pass it ,liberal
What in the actual fuck ,liberal
If it s such a good plan they should have to use it too Congress takes care of themselves before the people they represent ,liberal
I imagine many of you guys are pro obamacare If you are what would you prefer Jalen to me if I refused to get insurance and refused to pay the fine Assume I ll resist in every way in the spirit of this subreddit ,liberal
Weren t they exempt from original ACA ,liberal
Big anti Trump guy see my post history but see the edit in the Vox article The Republicans don t give a fuck about ACA or the alternative They get all the perks that are not covered by either anyway ,liberal
What s the GOP spin on this one then I m trying to figure out how they could explain this away but it seems so blatantly scummy ,liberal
https twitter com redditresist Hello r all In case you are curious r esist is a sub dedicated to compiling resources and fostering discussion to help resist the damage the Trump administration and those enabling it are doing to our country and the world If that sounds appealing to you please subscribe and look at the information we ve compiled so far and help us by offering more Also we ve just launched a twitter https twitter com redditresist account so please follow us there as well ,liberal
The main problem is not Trump The main problem is not the dynastic plutocratic families the corporate oligarchs and the international banksters many of whom are zionists like the neocons and members of AIPAC and or members of secret societies The main problem is not the government The main problem is not election rigging The main problem is not money The main problem is anyone who hasn t taken the time to become well informed free of misinformation and disinformation on all the major issues of today The main problem is anyone who is not giving their time energy talents and resources to the political process to make sure that only the most Loving and the most Wise among us become our public servants Everything that is happening in the world today is our responsibility each and every one of us without exception Not everyone who is active in politics is Totally Enlightened that s for sure but all those who are truly Totally Enlightened are most definitely active in politics Politics is Li,liberal
I bet his sons will have bone spurs similar to those that stopped Chancellor Cheeto from fighting in Vietnam but allowed him to safely play sports at home ,liberal
So you re saying we should let ISIS run rampant across the middle east ,liberal
this blood thirsty beep beep ,liberal
I think the thing I m the most worried about is that if trump goes to war he s gonna go to war As in full on full scale nuclear threat no limits war I hope that I m wrong but I kind of doubt it ,liberal
People who think and talk like this have never been to war people like um let s see Draft dodgers like Donald Ouch I have heel spur Trump ,liberal
He is right but not in the way that he thinks he is right War should be the last option and we should only go to war if 1 we can win quickly and 2 have a clear exit strategy ,liberal
We re already in a war that Bush and Obama started Time to end it ,liberal
I think what he is saying is that we have been in Iraq and the middle east for too long and if we ever have to go to war we should take care of it in a timely manner and not waste all our resources ,liberal
For all of the truthers out there Here s a WaPo article on it https www washingtonpost com world national security trump calls turkeys erdogan to congratulate him on contested referendum 2017 04 17 f997d306 2397 11e7 a1b3 faff0034e2de_story html And here s a readout where the WH confirms the call https twitter com BraddJaffy status 854130554349998080 ,liberal
deleted ,liberal
Citizens hate him How Trump will take over the country with 80 weird tricks ,liberal
The headline has more content then the tweet itself fascinating ,liberal
Maybe we need WWIII if only so DC gets nuked and these cretins in Cheetoface McTinyhands administration are removed from the face of the planet ,liberal
Months of silence about atrocities going on in turkey Months if not years of opression murder bombings and civil war Not one peep Now Trump gave his obligatory congratulations and everyone is up in arms about him doing it Still not a peep about what is going on in Turkey Give yourself a selective pat on the back ,liberal
Can t he just be doing the same thing many other leaders are doing as a keeping the peace measure Source http aa com tr en turkey world leaders congratulate erdogan on referendum win 798500 ,liberal
Trump wants to be like Erdogan ,liberal
Next would be congratulating Putin in 2028 ,liberal
Where were all of you when Obama did this during the coup Both left and right have done this Sad attempt ,liberal
Hello r all In case you are curious r esist is a sub dedicated to compiling resources and fostering discussion to help resist the damage the Trump administration is doing to our country and the world If that sounds appealing to you please subscribe and look at the information we ve compiled so far and help us by offering more ,liberal
